[
  {
    "law_id": "CPL-0001",
    "law_name": "中华人民共和国民事诉讼法（2023年修正）",
    "article": "第一条",
    "chapter": "第一编 总 则 第一章 任务、适用范围和基本原则",
    "topic": "任务、适用范围和基本原则",
    "legal_text": "中华人民共和国民事诉讼法以宪法为根据， 结合我国民事审判工作 的经验和实际情况制定。",
    "keywords": [
      "任务、适用范围和基本原则"
    ],
    "applicable_contracts": [
      "争议解决条款",
      "各类民商事合同"
    ],
    "risk_rules": [],
    "lawyer_application": "办理涉及任务、适用范围和基本原则的事项时，核对本条构成要件、程序要求及现有证据，并结合案件事实适用。",
    "source": "https://flk.npc.gov.cn/"
  },
  {
    "law_id": "CPL-0002",
    "law_name": "中华人民共和国民事诉讼法（2023年修正）",
    "article": "第二条",
    "chapter": "第一编 总 则 第一章 任务、适用范围和基本原则",
    "topic": "任务、适用范围和基本原则",
    "legal_text": "中华人民共和国民事诉讼法的任务，是保护当事人行使诉讼权利， 保证人民法院查明事实，分清是非，正确适用法律，及时审理民事案件，确认民 事权利义务关系，制裁民事违法行为，保护当事人的合法权益，教育公民自觉遵 守法律，维护社会秩序、经济秩序，保障社会主义建设事业顺利进行。",
    "keywords": [
      "人民法院",
      "当事人",
      "任务、适用范围和基本原则"
    ],
    "applicable_contracts": [
      "争议解决条款",
      "各类民商事合同"
    ],
    "risk_rules": [],
    "lawyer_application": "办理涉及任务、适用范围和基本原则的事项时，核对本条构成要件、程序要求及现有证据，并结合案件事实适用。",
    "source": "https://flk.npc.gov.cn/"
  },
  {
    "law_id": "CPL-0003",
    "law_name": "中华人民共和国民事诉讼法（2023年修正）",
    "article": "第三条",
    "chapter": "第一编 总 则 第一章 任务、适用范围和基本原则",
    "topic": "任务、适用范围和基本原则",
    "legal_text": "人民法院受理公民之间、法人之间、其他组织之间以及他们相互之 间因财产关系和人身关系提起的民事诉讼，适用本法的规定。",
    "keywords": [
      "人民法院",
      "任务、适用范围和基本原则"
    ],
    "applicable_contracts": [
      "争议解决条款",
      "各类民商事合同"
    ],
    "risk_rules": [],
    "lawyer_application": "办理涉及任务、适用范围和基本原则的事项时，核对本条构成要件、程序要求及现有证据，并结合案件事实适用。",
    "source": "https://flk.npc.gov.cn/"
  },
  {
    "law_id": "CPL-0004",
    "law_name": "中华人民共和国民事诉讼法（2023年修正）",
    "article": "第四条",
    "chapter": "第一编 总 则 第一章 任务、适用范围和基本原则",
    "topic": "任务、适用范围和基本原则",
    "legal_text": "凡在中华人民共和国领域内进行民事诉讼，必须遵守本法。",
    "keywords": [
      "任务、适用范围和基本原则"
    ],
    "applicable_contracts": [
      "争议解决条款",
      "各类民商事合同"
    ],
    "risk_rules": [],
    "lawyer_application": "办理涉及任务、适用范围和基本原则的事项时，核对本条构成要件、程序要求及现有证据，并结合案件事实适用。",
    "source": "https://flk.npc.gov.cn/"
  },
  {
    "law_id": "CPL-0005",
    "law_name": "中华人民共和国民事诉讼法（2023年修正）",
    "article": "第五条",
    "chapter": "第一编 总 则 第一章 任务、适用范围和基本原则",
    "topic": "任务、适用范围和基本原则",
    "legal_text": "外国人、无国籍人、外国企业和组织在人民法院起诉、应诉，同中 华人民共和国公民、法人和其他组织有同等的诉讼权利义务。 外国法院对中华人民共和国公民、 法人和其他组织的民事诉讼权利加以限制 的，中华人民共和国人民法院对该国公民、企业和组织的民事诉讼权利，实行对 等原则。",
    "keywords": [
      "人民法院",
      "起诉",
      "任务、适用范围和基本原则"
    ],
    "applicable_contracts": [
      "争议解决条款",
      "各类民商事合同"
    ],
    "risk_rules": [],
    "lawyer_application": "办理涉及任务、适用范围和基本原则的事项时，核对本条构成要件、程序要求及现有证据，并结合案件事实适用。",
    "source": "https://flk.npc.gov.cn/"
  },
  {
    "law_id": "CPL-0006",
    "law_name": "中华人民共和国民事诉讼法（2023年修正）",
    "article": "第六条",
    "chapter": "第一编 总 则 第一章 任务、适用范围和基本原则",
    "topic": "任务、适用范围和基本原则",
    "legal_text": "民事案件的审判权由人民法院行使。 人民法院依照法律规定对民事案件独立进行审判，不受行政机关、社会团体 和个人的干涉。",
    "keywords": [
      "人民法院",
      "任务、适用范围和基本原则"
    ],
    "applicable_contracts": [
      "争议解决条款",
      "各类民商事合同"
    ],
    "risk_rules": [],
    "lawyer_application": "办理涉及任务、适用范围和基本原则的事项时，核对本条构成要件、程序要求及现有证据，并结合案件事实适用。",
    "source": "https://flk.npc.gov.cn/"
  },
  {
    "law_id": "CPL-0007",
    "law_name": "中华人民共和国民事诉讼法（2023年修正）",
    "article": "第七条",
    "chapter": "第一编 总 则 第一章 任务、适用范围和基本原则",
    "topic": "任务、适用范围和基本原则",
    "legal_text": "人民法院审理民事案件，必须以事实为根据，以法律为准绳。",
    "keywords": [
      "人民法院",
      "任务、适用范围和基本原则"
    ],
    "applicable_contracts": [
      "争议解决条款",
      "各类民商事合同"
    ],
    "risk_rules": [],
    "lawyer_application": "办理涉及任务、适用范围和基本原则的事项时，核对本条构成要件、程序要求及现有证据，并结合案件事实适用。",
    "source": "https://flk.npc.gov.cn/"
  },
  {
    "law_id": "CPL-0008",
    "law_name": "中华人民共和国民事诉讼法（2023年修正）",
    "article": "第八条",
    "chapter": "第一编 总 则 第一章 任务、适用范围和基本原则",
    "topic": "任务、适用范围和基本原则",
    "legal_text": "民事诉讼当事人有平等的诉讼权利。人民法院审理民事案件，应当 保障和便利当事人行使诉讼权利，对当事人在适用法律上一律平等。",
    "keywords": [
      "人民法院",
      "当事人",
      "任务、适用范围和基本原则"
    ],
    "applicable_contracts": [
      "争议解决条款",
      "各类民商事合同"
    ],
    "risk_rules": [],
    "lawyer_application": "办理涉及任务、适用范围和基本原则的事项时，核对本条构成要件、程序要求及现有证据，并结合案件事实适用。",
    "source": "https://flk.npc.gov.cn/"
  },
  {
    "law_id": "CPL-0009",
    "law_name": "中华人民共和国民事诉讼法（2023年修正）",
    "article": "第九条",
    "chapter": "第一编 总 则 第一章 任务、适用范围和基本原则",
    "topic": "任务、适用范围和基本原则",
    "legal_text": "人民法院审理民事案件，应当根据自愿和合法的原则进行调解；调 解不成的，应当及时判决。",
    "keywords": [
      "人民法院",
      "任务、适用范围和基本原则"
    ],
    "applicable_contracts": [
      "争议解决条款",
      "各类民商事合同"
    ],
    "risk_rules": [],
    "lawyer_application": "办理涉及任务、适用范围和基本原则的事项时，核对本条构成要件、程序要求及现有证据，并结合案件事实适用。",
    "source": "https://flk.npc.gov.cn/"
  },
  {
    "law_id": "CPL-0010",
    "law_name": "中华人民共和国民事诉讼法（2023年修正）",
    "article": "第十条",
    "chapter": "第一编 总 则 第一章 任务、适用范围和基本原则",
    "topic": "任务、适用范围和基本原则",
    "legal_text": "人民法院审理民事案件，依照法律规定实行合议、回避、公开审判 和两审终审制度。",
    "keywords": [
      "人民法院",
      "任务、适用范围和基本原则"
    ],
    "applicable_contracts": [
      "争议解决条款",
      "各类民商事合同"
    ],
    "risk_rules": [],
    "lawyer_application": "办理涉及任务、适用范围和基本原则的事项时，核对本条构成要件、程序要求及现有证据，并结合案件事实适用。",
    "source": "https://flk.npc.gov.cn/"
  },
  {
    "law_id": "CPL-0011",
    "law_name": "中华人民共和国民事诉讼法（2023年修正）",
    "article": "第十一条",
    "chapter": "第一编 总 则 第一章 任务、适用范围和基本原则",
    "topic": "任务、适用范围和基本原则",
    "legal_text": "各民族公民都有用本民族语言、文字进行民事诉讼的权利。 在少数民族聚居或者多民族共同居住的地区， 人民法院应当用当地民族通用 的语言、文字进行审理和发布法律文书。 人民法院应当对不通晓当地民族通用的语言、文字的诉讼参与人提供翻译。",
    "keywords": [
      "人民法院",
      "任务、适用范围和基本原则"
    ],
    "applicable_contracts": [
      "争议解决条款",
      "各类民商事合同"
    ],
    "risk_rules": [],
    "lawyer_application": "办理涉及任务、适用范围和基本原则的事项时，核对本条构成要件、程序要求及现有证据，并结合案件事实适用。",
    "source": "https://flk.npc.gov.cn/"
  },
  {
    "law_id": "CPL-0012",
    "law_name": "中华人民共和国民事诉讼法（2023年修正）",
    "article": "第十二条",
    "chapter": "第一编 总 则 第一章 任务、适用范围和基本原则",
    "topic": "任务、适用范围和基本原则",
    "legal_text": "人民法院审理民事案件时，当事人有权进行辩论。",
    "keywords": [
      "人民法院",
      "当事人",
      "任务、适用范围和基本原则"
    ],
    "applicable_contracts": [
      "争议解决条款",
      "各类民商事合同"
    ],
    "risk_rules": [],
    "lawyer_application": "办理涉及任务、适用范围和基本原则的事项时，核对本条构成要件、程序要求及现有证据，并结合案件事实适用。",
    "source": "https://flk.npc.gov.cn/"
  },
  {
    "law_id": "CPL-0013",
    "law_name": "中华人民共和国民事诉讼法（2023年修正）",
    "article": "第十三条",
    "chapter": "第一编 总 则 第一章 任务、适用范围和基本原则",
    "topic": "任务、适用范围和基本原则",
    "legal_text": "民事诉讼应当遵循诚信原则。 当事人有权在法律规定的范围内处分自己的民事权利和诉讼权利。",
    "keywords": [
      "当事人",
      "任务、适用范围和基本原则"
    ],
    "applicable_contracts": [
      "争议解决条款",
      "各类民商事合同"
    ],
    "risk_rules": [],
    "lawyer_application": "办理涉及任务、适用范围和基本原则的事项时，核对本条构成要件、程序要求及现有证据，并结合案件事实适用。",
    "source": "https://flk.npc.gov.cn/"
  },
  {
    "law_id": "CPL-0014",
    "law_name": "中华人民共和国民事诉讼法（2023年修正）",
    "article": "第十四条",
    "chapter": "第一编 总 则 第一章 任务、适用范围和基本原则",
    "topic": "任务、适用范围和基本原则",
    "legal_text": "人民检察院有权对民事诉讼实行法律监督。",
    "keywords": [
      "任务、适用范围和基本原则"
    ],
    "applicable_contracts": [
      "争议解决条款",
      "各类民商事合同"
    ],
    "risk_rules": [],
    "lawyer_application": "办理涉及任务、适用范围和基本原则的事项时，核对本条构成要件、程序要求及现有证据，并结合案件事实适用。",
    "source": "https://flk.npc.gov.cn/"
  },
  {
    "law_id": "CPL-0015",
    "law_name": "中华人民共和国民事诉讼法（2023年修正）",
    "article": "第十五条",
    "chapter": "第一编 总 则 第一章 任务、适用范围和基本原则",
    "topic": "任务、适用范围和基本原则",
    "legal_text": "机关、社会团体、企业事业单位对损害国家、集体或者个人民事 权益的行为，可以支持受损害的单位或者个人向人民法院起诉。",
    "keywords": [
      "人民法院",
      "起诉",
      "任务、适用范围和基本原则"
    ],
    "applicable_contracts": [
      "争议解决条款",
      "各类民商事合同"
    ],
    "risk_rules": [],
    "lawyer_application": "办理涉及任务、适用范围和基本原则的事项时，核对本条构成要件、程序要求及现有证据，并结合案件事实适用。",
    "source": "https://flk.npc.gov.cn/"
  },
  {
    "law_id": "CPL-0016",
    "law_name": "中华人民共和国民事诉讼法（2023年修正）",
    "article": "第十六条",
    "chapter": "第一编 总 则 第一章 任务、适用范围和基本原则",
    "topic": "任务、适用范围和基本原则",
    "legal_text": "经当事人同意，民事诉讼活动可以通过信息网络平台在线进行。 民事诉讼活动通过信息网络平台在线进行的， 与线下诉讼活动具有同等法律 效力。",
    "keywords": [
      "当事人",
      "任务、适用范围和基本原则"
    ],
    "applicable_contracts": [
      "争议解决条款",
      "各类民商事合同"
    ],
    "risk_rules": [],
    "lawyer_application": "办理涉及任务、适用范围和基本原则的事项时，核对本条构成要件、程序要求及现有证据，并结合案件事实适用。",
    "source": "https://flk.npc.gov.cn/"
  },
  {
    "law_id": "CPL-0017",
    "law_name": "中华人民共和国民事诉讼法（2023年修正）",
    "article": "第十七条",
    "chapter": "第一编 总 则 第一章 任务、适用范围和基本原则",
    "topic": "任务、适用范围和基本原则",
    "legal_text": "民族自治地方的人民代表大会根据宪法和本法的原则， 结合当地 民族的具体情况，可以制定变通或者补充的规定。自治区的规定，报全国人民代 表大会常务委员会批准。自治州、自治县的规定，报省或者自治区的人民代表大 会常务委员会批准，并报全国人民代表大会常务委员会备案。",
    "keywords": [
      "任务、适用范围和基本原则"
    ],
    "applicable_contracts": [
      "争议解决条款",
      "各类民商事合同"
    ],
    "risk_rules": [],
    "lawyer_application": "办理涉及任务、适用范围和基本原则的事项时，核对本条构成要件、程序要求及现有证据，并结合案件事实适用。",
    "source": "https://flk.npc.gov.cn/"
  },
  {
    "law_id": "CPL-0018",
    "law_name": "中华人民共和国民事诉讼法（2023年修正）",
    "article": "第十八条",
    "chapter": "第一编 总 则 第二章 管 辖 第一节 级别管辖",
    "topic": "级别管辖",
    "legal_text": "基层人民法院管辖第一审民事案件，但本法另有规定的除外。",
    "keywords": [
      "人民法院",
      "管辖",
      "级别管辖"
    ],
    "applicable_contracts": [
      "争议解决条款",
      "各类民商事合同"
    ],
    "risk_rules": [],
    "lawyer_application": "办理涉及级别管辖的事项时，核对本条构成要件、程序要求及现有证据，并结合案件事实适用。",
    "source": "https://flk.npc.gov.cn/"
  },
  {
    "law_id": "CPL-0019",
    "law_name": "中华人民共和国民事诉讼法（2023年修正）",
    "article": "第十九条",
    "chapter": "第一编 总 则 第二章 管 辖 第一节 级别管辖",
    "topic": "级别管辖",
    "legal_text": "中级人民法院管辖下列第一审民事案件： （一）重大涉外案件； （二）在本辖区有重大影响的案件； （三）最高人民法院确定由中级人民法院管辖的案件。",
    "keywords": [
      "人民法院",
      "管辖",
      "级别管辖"
    ],
    "applicable_contracts": [
      "争议解决条款",
      "各类民商事合同"
    ],
    "risk_rules": [],
    "lawyer_application": "办理涉及级别管辖的事项时，核对本条构成要件、程序要求及现有证据，并结合案件事实适用。",
    "source": "https://flk.npc.gov.cn/"
  },
  {
    "law_id": "CPL-0020",